{"$schema":"https://json-schema.org/draft/2020-12/schema","additionalProperties":false,"properties":{"message_id":{"format":"uuid","type":"string"},"offer_message_id":{"format":"uuid","type":"string"},"provider_id":{"minLength":3,"type":"string"},"release_id":{"format":"uuid","type":"string"},"schema":{"const":"omarchygs.provider-compatibility-selection/v1"},"selected":{"additionalProperties":false,"properties":{"capabilities":{"const":["game.launch","game.command","game.reconcile","game.event"]},"protocol_version":{"const":1}},"required":["protocol_version","capabilities"],"type":"object"}},"required":["schema","provider_id","release_id","offer_message_id","message_id","selected"],"type":"object"}
